{
  "status": "completed",
  "request_file": "memory-request-explicit-chat-valid.json",
  "current": {
    "content": {}
  },
  "long_term_candidates": [
    {
      "candidate_id": "candidate-explicit-chat-create",
      "title": "前端技术栈",
      "memory_kind": "fact",
      "action": "CREATE",
      "match": {
        "classification": "novel",
        "entry_ids": []
      },
      "conflict_status": "none",
      "content": "项目使用 Vue 3。",
      "rationale": "用户明确要求记住，且限定检索范围内没有重复或冲突条目。",
      "source": {
        "type": "user-message",
        "id": "src-8f10f07960b6b8d5",
        "created_at": "2026-09-15T04:00:00Z"
      },
      "source_refs": [
        ".xiaotao/memory/sources/src-8f10f07960b6b8d5.json"
      ]
    }
  ]
}
